{
  "version": "1.0",
  "generated_at": "2025-04-19T11:30:00Z",
  "readme": {
    "present": ["name", "one_liner", "install", "run", "env", "demo", "stack"],
    "missing": []
  },
  "secret_scan": {
    "clean": true,
    "findings": []
  },
  "checklist": {
    "passed": ["source_code", "readme", "env_docs", "dep_files", "run_docs"],
    "failed": ["demo_video_or_link", "screenshots", "deployment_link"]
  },
  "reproducible": {
    "ok": true,
    "reason": "README + package.json present."
  },
  "packaging_command": "tar czf submit.tar.gz --exclude=node_modules --exclude=.env --exclude=.git --exclude=dist --exclude=.next ."
}
